<?xml version="1.0" encoding="UTF-8"?>
<?xml-stylesheet type='text/xsl' href='trends.xsl'?>

<game_sales xmlns:xsi="http://www.w3.org/2001/XMLSchema-instance"
            xsi:noNamespaceSchemaLocation="trends.xsd">
	<sales year="2007">
            <platform type="console">
                <sale>
                    <genre>Strategy</genre>
                    <percentage>4.7</percentage>
                </sale>
                <sale>
                    <genre>Adventure</genre>
                    <percentage>4.3</percentage>
                </sale>
                <sale>
                    <genre>Fighting</genre>
                    <percentage>4.5</percentage>
                </sale>
                <sale>
                    <genre>Family</genre>
                    <percentage>17.6</percentage>
                </sale>
                <sale>
                    <genre>Role-Playing</genre>
                    <percentage>7.6</percentage>
                </sale>
                <sale>
                    <genre>Shooter</genre>
                    <percentage>12.1</percentage>
                </sale>
                <sale>
                    <genre>Other</genre>
                    <percentage>2.3</percentage>
                </sale>
                <sale>
                    <genre>Arcade</genre>
                    <percentage>1.0</percentage>
                </sale>
                <sale>
                    <genre>Flight</genre>
                    <percentage>0.5</percentage>
                </sale>
                <sale>
                    <genre>Action</genre>
                    <percentage>0.7</percentage>
                </sale>
                <sale>
                    <genre>Children</genre>
                    <percentage>22.3</percentage>
                </sale>
                <sale>
                    <genre>Sports</genre>
                    <percentage>14.1</percentage>
                </sale>
                <sale>
                    <genre>Racing</genre>
                    <percentage>8.3</percentage>
                </sale>
                <sale>
                    <genre>Casual</genre>
                    <percentage>0.0</percentage>
                </sale>
            </platform>
            <platform type="computer">
                <sale>
                    <genre>Strategy</genre>
                    <percentage>33.9</percentage>
                </sale>
                <sale>
                    <genre>Adventure</genre>
                    <percentage>5.0</percentage>
                </sale>
                <sale>
                    <genre>Fighting</genre>
                    <percentage>0.0</percentage>
                </sale>
                <sale>
                    <genre>Family</genre>
                    <percentage>14.3</percentage>
                </sale>
                <sale>
                    <genre>Role-Playing</genre>
                    <percentage>18.8</percentage>
                </sale>
                <sale>
                    <genre>Shooter</genre>
                    <percentage>11.6</percentage>
                </sale>
                <sale>
                    <genre>Other</genre>
                    <percentage>3.0</percentage>
                </sale>
                <sale>
                    <genre>Arcade</genre>
                    <percentage>0.9</percentage>
                </sale>
                <sale>
                    <genre>Flight</genre>
                    <percentage>2.2</percentage>
                </sale>
                <sale>
                    <genre>Action</genre>
                    <percentage>2.6</percentage>
                </sale>
                <sale>
                    <genre>Children</genre>
                    <percentage>3.5</percentage>
                </sale>
                <sale>
                    <genre>Sports</genre>
                    <percentage>2.5</percentage>
                </sale>
                <sale>
                    <genre>Racing</genre>
                    <percentage>1.5</percentage>
                </sale>
                <sale>
                    <genre>Casual</genre>
                    <percentage>0.0</percentage>
                </sale>
            </platform>
	</sales>
	<sales year="2008">
            <platform type="console">
                <sale>
                    <genre>Strategy</genre>
                    <percentage>6.2</percentage>
                </sale>
                <sale>
                    <genre>Adventure</genre>
                    <percentage>5.3</percentage>
                </sale>
                <sale>
                    <genre>Fighting</genre>
                    <percentage>5.1</percentage>
                </sale>
                <sale>
                    <genre>Family</genre>
                    <percentage>19.3</percentage>
                </sale>
                <sale>
                    <genre>Role-Playing</genre>
                    <percentage>5.4</percentage>
                </sale>
                <sale>
                    <genre>Shooter</genre>
                    <percentage>10.9</percentage>
                </sale>
                <sale>
                    <genre>Other</genre>
                    <percentage>2.2</percentage>
                </sale>
                <sale>
                    <genre>Arcade</genre>
                    <percentage>0.5</percentage>
                </sale>
                <sale>
                    <genre>Flight</genre>
                    <percentage>0.5</percentage>
                </sale>
                <sale>
                    <genre>Action</genre>
                    <percentage>20.0</percentage>
                </sale>
                <sale>
                    <genre>Children</genre>
                    <percentage>0.9</percentage>
                </sale>
                <sale>
                    <genre>Sports</genre>
                    <percentage>15.3</percentage>
                </sale>
                <sale>
                    <genre>Racing</genre>
                    <percentage>8.4</percentage>
                </sale>
                <sale>
                    <genre>Casual</genre>
                    <percentage>0.0</percentage>
                </sale>
            </platform>
            <platform type="computer">
                <sale>
                    <genre>Strategy</genre>
                    <percentage>34.6</percentage>
                </sale>
                <sale>
                    <genre>Adventure</genre>
                    <percentage>6.8</percentage>
                </sale>
                <sale>
                    <genre>Fighting</genre>
                    <percentage>0.1</percentage>
                </sale>
                <sale>
                    <genre>Family</genre>
                    <percentage>17.7</percentage>
                </sale>
                <sale>
                    <genre>Role-Playing</genre>
                    <percentage>19.6</percentage>
                </sale>
                <sale>
                    <genre>Shooter</genre>
                    <percentage>9.7</percentage>
                </sale>
                <sale>
                    <genre>Other</genre>
                    <percentage>1.4</percentage>
                </sale>
                <sale>
                    <genre>Arcade</genre>
                    <percentage>0.5</percentage>
                </sale>
                <sale>
                    <genre>Flight</genre>
                    <percentage>1.8</percentage>
                </sale>
                <sale>
                    <genre>Action</genre>
                    <percentage>2.7</percentage>
                </sale>
                <sale>
                    <genre>Children</genre>
                    <percentage>2.5</percentage>
                </sale>
                <sale>
                    <genre>Sports</genre>
                    <percentage>1.8</percentage>
                </sale>
                <sale>
                    <genre>Racing</genre>
                    <percentage>1.4</percentage>
                </sale>
                <sale>
                    <genre>Casual</genre>
                    <percentage>0.0</percentage>
                </sale>
            </platform>
	</sales>
	<sales year="2009">
            <platform type="console">
                <sale>
                    <genre>Strategy</genre>
                    <percentage>6.4</percentage>
                </sale>
                <sale>
                    <genre>Adventure</genre>
                    <percentage>6.6</percentage>
                </sale>
                <sale>
                    <genre>Fighting</genre>
                    <percentage>4.1</percentage>
                </sale>
                <sale>
                    <genre>Family</genre>
                    <percentage>15.3</percentage>
                </sale>
                <sale>
                    <genre>Role-Playing</genre>
                    <percentage>5.8</percentage>
                </sale>
                <sale>
                    <genre>Shooter</genre>
                    <percentage>12.2</percentage>
                </sale>
                <sale>
                    <genre>Other</genre>
                    <percentage>2.0</percentage>
                </sale>
                <sale>
                    <genre>Arcade</genre>
                    <percentage>0.3</percentage>
                </sale>
                <sale>
                    <genre>Flight</genre>
                    <percentage>0.4</percentage>
                </sale>
                <sale>
                    <genre>Action</genre>
                    <percentage>19.5</percentage>
                </sale>
                <sale>
                    <genre>Children</genre>
                    <percentage>0.9</percentage>
                </sale>
                <sale>
                    <genre>Sports</genre>